{
  "$schema": "https://json-schema.org/draft/2020-12/schema",
  "$id": "https://simpler.grants.gov/form-spec/contract/v1/evidence.schema.json",
  "title": "Portable source and semantic-review evidence",
  "type": "object",
  "additionalProperties": false,
  "required": ["contract", "block", "sources", "extraction", "semanticReview"],
  "properties": {
    "contract": { "const": "grants-form-evidence/v1" },
    "block": {
      "type": "object",
      "additionalProperties": false,
      "required": ["id", "kind"],
      "properties": {
        "id": { "type": "string", "minLength": 1 },
        "kind": { "enum": ["question", "form"] },
        "formVersion": {
          "type": "string",
          "minLength": 1,
          "description": "Canonical form version whose emitted artifact this evidence describes. This is not a source document's native version."
        }
      },
      "allOf": [
        {
          "if": {
            "properties": { "kind": { "const": "form" } },
            "required": ["kind"]
          },
          "then": {
            "properties": { "formVersion": true },
            "required": ["formVersion"]
          },
          "else": { "properties": { "formVersion": false } }
        }
      ]
    },
    "sources": {
      "type": "array",
      "minItems": 1,
      "items": {
        "type": "object",
        "additionalProperties": false,
        "required": ["id", "type", "uri", "nativeVersion", "sha256"],
        "properties": {
          "id": { "type": "string", "minLength": 1 },
          "type": { "enum": ["xsd", "dat", "pdf", "instructions", "implementation"] },
          "uri": { "type": "string", "pattern": "^https://" },
          "nativeVersion": {
            "type": ["string", "null"],
            "minLength": 1,
            "description": "Version stated by this exact source. Null means the source does not state a version or the native version is unknown; never inherit the canonical form version."
          },
          "sha256": { "type": "string", "pattern": "^[0-9a-f]{64}$" }
        }
      }
    },
    "inheritsBehaviorEvidenceFrom": {
      "type": "array",
      "uniqueItems": true,
      "items": { "$ref": "#/$defs/behaviorEvidenceInheritance" }
    },
    "behaviorEvidence": {
      "type": "array",
      "items": { "$ref": "#/$defs/behaviorEvidence" }
    },
    "extraction": {
      "type": "object",
      "additionalProperties": false,
      "required": ["repository", "revision", "artifact", "sourceSetSha256", "extractedAt"],
      "properties": {
        "repository": { "type": "string", "pattern": "^https://" },
        "revision": { "type": "string", "pattern": "^[0-9a-f]{40}$" },
        "artifact": {
          "type": "string",
          "pattern": "^(?!/)(?!.*(?:^|/)\\.\\.(?:/|$)).+$"
        },
        "sourceSetSha256": { "type": "string", "pattern": "^[0-9a-f]{64}$" },
        "extractedAt": {
          "type": "string",
          "pattern": "^[0-9]{4}-[0-9]{2}-[0-9]{2}T[0-9]{2}:[0-9]{2}:[0-9]{2}(?:\\.[0-9]+)?Z$"
        }
      }
    },
    "semanticReview": {
      "type": "object",
      "additionalProperties": false,
      "required": ["status", "mappings"],
      "properties": {
        "status": { "enum": ["unreviewed", "proposed", "reviewed", "accepted", "rejected"] },
        "mappings": {
          "type": "array",
          "items": { "$ref": "#/$defs/mapping" }
        }
      }
    }
  },
  "$defs": {
    "behaviorEvidenceInheritance": {
      "type": "object",
      "additionalProperties": false,
      "required": ["blockId", "mountPath"],
      "properties": {
        "blockId": { "type": "string", "minLength": 1 },
        "mountPath": { "type": "string" }
      }
    },
    "behaviorEvidence": {
      "oneOf": [
        { "$ref": "#/$defs/sourceBoundBehaviorEvidence" },
        { "$ref": "#/$defs/unresolvedBehaviorEvidence" }
      ]
    },
    "behaviorEvidenceBase": {
      "type": "object",
      "required": ["canonicalPath", "ruleKind", "authority"],
      "properties": {
        "canonicalPath": { "type": "string", "minLength": 1 },
        "ruleKind": { "enum": ["calculation", "condition"] },
        "authority": {
          "enum": ["official_source", "implementation_parity", "unresolved"]
        },
        "executionStatus": { "enum": ["compiled", "source-bound-uncompiled"] },
        "inheritedFrom": { "type": "string", "minLength": 1 }
      }
    },
    "sourceBoundBehaviorEvidence": {
      "allOf": [
        { "$ref": "#/$defs/behaviorEvidenceBase" },
        {
          "type": "object",
          "additionalProperties": false,
          "required": [
            "canonicalPath", "ruleKind", "authority", "sourceId", "sourcePath", "sourceRecord"
          ],
          "properties": {
            "canonicalPath": { "type": "string", "minLength": 1 },
            "ruleKind": { "enum": ["calculation", "condition"] },
            "authority": { "enum": ["official_source", "implementation_parity"] },
            "sourceId": { "type": "string", "minLength": 1 },
            "sourcePath": { "type": "string", "minLength": 1 },
            "sourceRecord": { "type": "string", "minLength": 1 },
            "executionStatus": { "enum": ["compiled", "source-bound-uncompiled"] },
            "inheritedFrom": { "type": "string", "minLength": 1 }
          }
        }
      ]
    },
    "unresolvedBehaviorEvidence": {
      "allOf": [
        { "$ref": "#/$defs/behaviorEvidenceBase" },
        {
          "type": "object",
          "additionalProperties": false,
          "required": [
            "canonicalPath", "ruleKind", "authority", "owner", "reason", "removalCondition"
          ],
          "properties": {
            "canonicalPath": { "type": "string", "minLength": 1 },
            "ruleKind": { "enum": ["calculation", "condition"] },
            "authority": { "const": "unresolved" },
            "owner": { "type": "string", "minLength": 1 },
            "reason": { "type": "string", "minLength": 1 },
            "removalCondition": { "type": "string", "minLength": 1 },
            "executionStatus": { "enum": ["compiled", "source-bound-uncompiled"] },
            "inheritedFrom": { "type": "string", "minLength": 1 }
          }
        }
      ]
    },
    "mapping": {
      "type": "object",
      "additionalProperties": false,
      "required": ["canonicalPointer", "sourceId", "sourcePath", "status"],
      "properties": {
        "canonicalPointer": { "type": "string", "pattern": "^#(?:$|/)" },
        "sourceId": { "type": "string", "minLength": 1 },
        "sourcePath": { "type": "string", "minLength": 1 },
        "status": { "enum": ["proposed", "reviewed", "accepted", "rejected"] },
        "reviewedBy": { "type": "string", "minLength": 1 },
        "reviewedAt": {
          "type": "string",
          "pattern": "^[0-9]{4}-[0-9]{2}-[0-9]{2}T[0-9]{2}:[0-9]{2}:[0-9]{2}(?:\\.[0-9]+)?Z$"
        },
        "note": { "type": "string" }
      },
      "allOf": [
        {
          "if": { "properties": { "status": { "const": "accepted" } }, "required": ["status"] },
          "then": {
            "properties": {
              "reviewedBy": { "type": "string", "minLength": 1 },
              "reviewedAt": {
                "type": "string",
                "pattern": "^[0-9]{4}-[0-9]{2}-[0-9]{2}T[0-9]{2}:[0-9]{2}:[0-9]{2}(?:\\.[0-9]+)?Z$"
              }
            },
            "required": ["reviewedBy", "reviewedAt"]
          }
        }
      ]
    }
  }
}
