{
  "block": {
    "id": "performance-site",
    "kind": "form",
    "formVersion": "4.0"
  },
  "contract": "grants-form-evidence/v1",
  "extraction": {
    "artifact": "artifacts/proof/grantsgov-PerformanceSite.jsonl.manifest.json",
    "extractedAt": "2026-08-18T16:54:27.985042Z",
    "repository": "https://github.com/mikec-ai/grants-question-crosswalk",
    "revision": "4312f6504b060e2b9ffdbd2307fc41130c3123a0",
    "sourceSetSha256": "ba3348472c48a2fac951308c9a8f44fc078c5b014771d7e9d1a4b0521a00d879"
  },
  "semanticReview": {
    "mappings": [],
    "status": "unreviewed"
  },
  "sources": [
    {
      "id": "source-1-c0747c333fb8",
      "sha256": "c0747c333fb89f0be2403e1b4b2beb6ab971391fd85c6aa0cf0a678519e26615",
      "type": "dat",
      "uri": "https://apply07.grants.gov/apply/forms/sample/PerformanceSite_4_0-V4.0_F723.xls",
      "nativeVersion": null
    },
    {
      "id": "source-2-d47dbb254b11",
      "sha256": "d47dbb254b112f69dc308c01dea2fe15b29114d0e3bdc5a137d3178b5af7bc6c",
      "type": "xsd",
      "uri": "https://apply07.grants.gov/apply/forms/schemas/PerformanceSite_4_0-V4.0.xsd",
      "nativeVersion": "4.0"
    },
    {
      "id": "source-3-ae2ebb3618f7",
      "sha256": "ae2ebb3618f7d8fb337be2309b3096e9121b4af659e913af423aab85d13dcb1d",
      "type": "xsd",
      "uri": "https://apply07.grants.gov/apply/system/schemas/Attachments-V1.0.xsd",
      "nativeVersion": "1.0"
    },
    {
      "id": "source-4-4b338db91915",
      "sha256": "4b338db919152eb8b96a1a846902d04ef8bca8d08127b21f80f927eaa62283cb",
      "type": "xsd",
      "uri": "https://apply07.grants.gov/apply/system/schemas/Global-V1.0.xsd",
      "nativeVersion": "1.0"
    },
    {
      "id": "source-5-ff0214de91b9",
      "sha256": "ff0214de91b95a4209f50f0fe08a18d0f3d17f280ab8c8bbcb52878f37de7be8",
      "type": "xsd",
      "uri": "https://apply07.grants.gov/apply/system/schemas/GlobalLibrary-V2.0.xsd",
      "nativeVersion": "2.0"
    },
    {
      "id": "source-6-78f33338e931",
      "sha256": "78f33338e9319ef31a052d1328b8984931a4380db2485493bcc78ab9e2c11f3a",
      "type": "xsd",
      "uri": "https://apply07.grants.gov/apply/system/schemas/UniversalCodes-V2.0.xsd",
      "nativeVersion": "2.0"
    }
  ],
  "behaviorEvidence": [
    {
      "canonicalPath": "/primarySite/address/state",
      "ruleKind": "condition",
      "authority": "official_source",
      "executionStatus": "source-bound-uncompiled",
      "sourceId": "source-1-c0747c333fb8",
      "sourcePath": "1-07",
      "sourceRecord": "Conditionally required if Country is US then active. If Country is not US, then inactive"
    },
    {
      "canonicalPath": "primarySite.address.state",
      "ruleKind": "condition",
      "authority": "unresolved",
      "executionStatus": "compiled",
      "owner": "form-semantic-review",
      "reason": "The portable UI compiles the country-dependent active/inactive interaction, but the source also says the State is conditionally required for a US address. The emitted schema does not yet compile that requiredness, so the current interaction is not asserted as complete source parity.",
      "removalCondition": "Resolve the exact active-versus-required interpretation and either compile the complete official rule or record an approved source-parity exception."
    },
    {
      "canonicalPath": "/primarySite/address/province",
      "ruleKind": "condition",
      "authority": "official_source",
      "executionStatus": "source-bound-uncompiled",
      "sourceId": "source-1-c0747c333fb8",
      "sourcePath": "1-08",
      "sourceRecord": "If Country is US then inactive. If Country is not US, then active"
    },
    {
      "canonicalPath": "primarySite.address.province",
      "ruleKind": "condition",
      "authority": "unresolved",
      "executionStatus": "compiled",
      "owner": "form-semantic-review",
      "reason": "The portable UI renders Province read-only for a US address and enabled otherwise. Human review must decide whether read-only is equivalent to the source's inactive behavior, including whether an existing province value must be cleared.",
      "removalCondition": "Approve the read-only projection as exact parity or compile the source-required disabled and value-clearing behavior."
    },
    {
      "canonicalPath": "/additionalSites/[]/address/state",
      "ruleKind": "condition",
      "authority": "official_source",
      "executionStatus": "source-bound-uncompiled",
      "sourceId": "source-1-c0747c333fb8",
      "sourcePath": "2-08",
      "sourceRecord": "Conditionally required if Country is US then active. If Country is not US, then inactive"
    },
    {
      "canonicalPath": "additionalSites[*].address.state",
      "ruleKind": "condition",
      "authority": "unresolved",
      "executionStatus": "compiled",
      "owner": "form-semantic-review",
      "reason": "The repeating-site UI compiles the country-dependent active/inactive interaction, but the source also says the State is conditionally required for a US address. The emitted item schema does not yet compile that requiredness.",
      "removalCondition": "Resolve the exact active-versus-required interpretation and either compile the complete official repeating-item rule or record an approved source-parity exception."
    },
    {
      "canonicalPath": "/additionalSites/[]/address/province",
      "ruleKind": "condition",
      "authority": "official_source",
      "executionStatus": "source-bound-uncompiled",
      "sourceId": "source-1-c0747c333fb8",
      "sourcePath": "2-08a",
      "sourceRecord": "If Country is US then inactive. If Country is not US, then active"
    },
    {
      "canonicalPath": "additionalSites[*].address.province",
      "ruleKind": "condition",
      "authority": "unresolved",
      "executionStatus": "compiled",
      "owner": "form-semantic-review",
      "reason": "The repeating-site UI renders Province read-only for a US address and enabled otherwise. Human review must decide whether read-only is equivalent to the source's inactive behavior, including whether an existing province value must be cleared.",
      "removalCondition": "Approve the read-only projection as exact parity or compile the source-required disabled and value-clearing behavior for repeating sites."
    },
    {
      "canonicalPath": "additionalLocations",
      "ruleKind": "condition",
      "authority": "official_source",
      "executionStatus": "compiled",
      "sourceId": "source-1-c0747c333fb8",
      "sourcePath": "3-3",
      "sourceRecord": "Button becomes active only after the maximum number of sites (i.e 299) has been entered."
    }
  ]
}
