{
  "block": {
    "id": "rr-key-person-expanded",
    "kind": "form",
    "formVersion": "4.0"
  },
  "contract": "grants-form-evidence/v1",
  "extraction": {
    "artifact": "artifacts/proof/grantsgov-RRKeyPersonExpanded.jsonl.manifest.json",
    "extractedAt": "2026-08-18T16:54:30.352133Z",
    "repository": "https://github.com/mikec-ai/grants-question-crosswalk",
    "revision": "4312f6504b060e2b9ffdbd2307fc41130c3123a0",
    "sourceSetSha256": "8866396d99e32eeec6618ea63c52c2b205718dc481482b27ab61699ecd2efeb0"
  },
  "semanticReview": {
    "mappings": [],
    "status": "unreviewed"
  },
  "sources": [
    {
      "id": "source-1-5e24647ca453",
      "sha256": "5e24647ca453b736143af73d2f75aaae41b4ae828e44a83f2dcf5b212f6e79e1",
      "type": "dat",
      "uri": "https://apply07.grants.gov/apply/forms/sample/RR_KeyPersonExpanded_4_0-V4.0_F774.xls",
      "nativeVersion": "4.0"
    },
    {
      "id": "source-2-c1522304f37b",
      "sha256": "c1522304f37bb91a1fc18f2b84656c570581969f9c1795d18352bc273d691b8b",
      "type": "xsd",
      "uri": "https://apply07.grants.gov/apply/forms/schemas/RR_KeyPersonExpanded_4_0-V4.0.xsd",
      "nativeVersion": "4.0"
    },
    {
      "id": "source-3-ae2ebb3618f7",
      "sha256": "ae2ebb3618f7d8fb337be2309b3096e9121b4af659e913af423aab85d13dcb1d",
      "type": "xsd",
      "uri": "https://apply07.grants.gov/apply/system/schemas/Attachments-V1.0.xsd",
      "nativeVersion": "1.0"
    },
    {
      "id": "source-4-4b338db91915",
      "sha256": "4b338db919152eb8b96a1a846902d04ef8bca8d08127b21f80f927eaa62283cb",
      "type": "xsd",
      "uri": "https://apply07.grants.gov/apply/system/schemas/Global-V1.0.xsd",
      "nativeVersion": "1.0"
    },
    {
      "id": "source-5-ff0214de91b9",
      "sha256": "ff0214de91b95a4209f50f0fe08a18d0f3d17f280ab8c8bbcb52878f37de7be8",
      "type": "xsd",
      "uri": "https://apply07.grants.gov/apply/system/schemas/GlobalLibrary-V2.0.xsd",
      "nativeVersion": "2.0"
    },
    {
      "id": "source-6-78f33338e931",
      "sha256": "78f33338e9319ef31a052d1328b8984931a4380db2485493bcc78ab9e2c11f3a",
      "type": "xsd",
      "uri": "https://apply07.grants.gov/apply/system/schemas/UniversalCodes-V2.0.xsd",
      "nativeVersion": "2.0"
    }
  ]
}
